{
  "$schema": "https://json-schema.org/draft/2020-12/schema",
  "$id": "https://mtp.schemas.databiomes.com/v1/template_1_2_0.json",
  "title": "Template",
  "description": "Main model for MTP Template JSON structure.",
  "$defs": {
    "ExampleUsage": {
      "description": "Model for example usage in template.",
      "properties": {
        "instruction_input": {
          "title": "Instruction Input",
          "type": "string"
        },
        "valid_model_output": {
          "title": "Valid Model Output",
          "type": "string"
        },
        "guardrail_model_output": {
          "title": "Guardrail Model Output",
          "type": "string"
        }
      },
      "required": [
        "instruction_input",
        "valid_model_output",
        "guardrail_model_output"
      ],
      "title": "ExampleUsage",
      "type": "object"
    },
    "InstructionDefinition": {
      "description": "Model for a single instruction definition in the template.",
      "properties": {
        "type": {
          "enum": [
            "basic",
            "extended",
            "state_machine"
          ],
          "title": "Type",
          "type": "string"
        },
        "input": {
          "items": {
            "type": "string"
          },
          "title": "Input",
          "type": "array"
        },
        "output": {
          "items": {
            "type": "string"
          },
          "title": "Output",
          "type": "array"
        }
      },
      "required": [
        "type",
        "input",
        "output"
      ],
      "title": "InstructionDefinition",
      "type": "object"
    },
    "Tokens": {
      "description": "Model for tokens in template (input and output mappings).",
      "properties": {
        "input": {
          "additionalProperties": {
            "type": "string"
          },
          "title": "Input",
          "type": "object"
        },
        "output": {
          "additionalProperties": {
            "type": "string"
          },
          "title": "Output",
          "type": "object"
        }
      },
      "required": [
        "input",
        "output"
      ],
      "title": "Tokens",
      "type": "object"
    }
  },
  "properties": {
    "encrypt": {
      "title": "Encrypt",
      "type": "boolean"
    },
    "state_machine": {
      "title": "State Machine",
      "type": "boolean"
    },
    "inputs": {
      "title": "Inputs",
      "type": "integer"
    },
    "tokens": {
      "$ref": "#/$defs/Tokens"
    },
    "instructions": {
      "additionalProperties": {
        "$ref": "#/$defs/InstructionDefinition"
      },
      "title": "Instructions",
      "type": "object"
    },
    "states": {
      "items": {
        "type": "string"
      },
      "title": "States",
      "type": "array"
    },
    "example_usage": {
      "$ref": "#/$defs/ExampleUsage"
    }
  },
  "required": [
    "encrypt",
    "state_machine",
    "inputs",
    "tokens",
    "instructions",
    "states",
    "example_usage"
  ],
  "type": "object"
}