{
    "$schema": "https://mtp.schemas.databiomes.com/v1/template_1_2_0.json",
    "encrypt": false,
    "state_machine": false,
    "inputs": 2,
    "tokens": {
        "input": {
            "Tree_English_Alice_Talk_": "Tree_English_Alice_Talk_",
            "Tree_English_Alice_Talk_Emotion_": "Tree_English_Alice_Talk_Emotion_<num_0_10>",
            "Tree_English_Cat_Talk_": "Tree_English_Cat_Talk_",
            "Tree_English_Cat_Talk_Coordinates_": "Tree_English_Cat_Talk_Coordinates_<num_-1000_1000_3>",
            "Tree_English_Dissipate_Cat_Talk_": "Tree_English_Dissipate_Cat_Talk_"
        },
        "output": {
            "<UNK>": "<UNK>",
            "Appear_": "Appear_",
            "Continue_": "Continue_",
            "Madness_": "Madness_",
            "Vanish_": "Vanish_"
        }
    },
    "instructions": {
        "alice_cat_alice_continue": {
            "type": "basic",
            "input": [
                "<BOS>\n",
                "Tree_English_Cat_Talk_\n<string>\n",
                "Tree_English_Alice_Talk_\n<string>\n",
                "Tree_English_Cat_Talk_\n",
                "<RUN>"
            ],
            "output": [
                "<string>\nContinue_<UNK>_\n<EOS>",
                "<string>\nContinue_\n<EOS>"
            ]
        },
        "alice_cat_alice_appear_disappear": {
            "type": "basic",
            "input": [
                "<BOS>\n",
                "Tree_English_Dissipate_Cat_Talk_\n<string>\n",
                "Tree_English_Alice_Talk_\n<string>\n",
                "Tree_English_Cat_Talk_\n",
                "<RUN>"
            ],
            "output": [
                "<string>\nVanish_\n<EOS>",
                "<string>\nAppear_\n<EOS>"
            ]
        },
        "alice_cat_alice_instruction_numeric": {
            "type": "basic",
            "input": [
                "<BOS>\n",
                "Tree_English_Cat_Talk_Coordinates_<num_-1000_1000_3>\n<string>\n",
                "Tree_English_Alice_Talk_Emotion_<num_0_10>\n<string>\n",
                "Tree_English_Cat_Talk_\n",
                "<RUN>"
            ],
            "output": [
                "<string>\nMadness_\n<EOS>"
            ]
        }
    },
    "states": [],
    "example_usage": {
        "instruction_input": "<BOS>\nTree_English_Cat_Talk_Coordinates_[-583, -681, 941]\nThen it doesnt matter which way you go.\nTree_English_Alice_Talk_Emotion_10\nCan you tell me a way?\nTree_English_Cat_Talk_\n<RUN>\n",
        "valid_model_output": "Then it doesnt matter which way you go.\nMadness_\n<EOS>",
        "guardrail_model_output": "Are you as mad as me?\nContinue_<UNK>_\n<EOS>"
    }
}